{
  "schema_version": "v1",
  "response_type": "evidence_bundle",
  "product_boundary": "evidence_and_procedure_only",
  "evidence_bundle_id": "bbbbbbbb-bbbb-4bbb-8bbb-bbbbbbbbbbbb",
  "tenant_id": "11111111-1111-4111-8111-111111111111",
  "request_id": "22222222-2222-4222-8222-222222222222",
  "query": "¿Qué referencia documental existe para un proyecto municipal de agua?",
  "jurisdiction": "Municipio de La Antigua Guatemala, Sacatepéquez, Guatemala",
  "generated_at": "2026-07-18T18:00:00Z",
  "sources": [
    {
      "source_id": "55555555-5555-4555-8555-555555555555",
      "document_id": "66666666-6666-4666-8666-666666666666",
      "document_version_id": "77777777-7777-4777-8777-777777777777",
      "title": "MNPP Dirección de Aguas y Drenajes de Mixco",
      "municipality": "mixco",
      "source_jurisdiction": "Municipio de Mixco, Guatemala",
      "target_jurisdiction": "Municipio de La Antigua Guatemala, Sacatepéquez, Guatemala",
      "authority_status": "comparative",
      "official_source": true,
      "official_for_target_jurisdiction": false,
      "source_url": "https://munimixco.gob.gt/manuales/aguas-drenajes",
      "content_sha256": null,
      "status": "verified",
      "limitations": [
        "Referencia comparativa de la Municipalidad de Mixco. No define por sí sola el procedimiento oficial de Antigua Guatemala."
      ]
    }
  ],
  "claims": [
    {
      "claim_id": "aaaaaaaa-aaaa-4aaa-8aaa-aaaaaaaaaaaa",
      "text": "La fuente de Mixco sólo puede utilizarse como referencia comparativa para Antigua Guatemala.",
      "citation_refs": [
        "99999999-9999-4999-8999-999999999999"
      ],
      "evidence_status": "comparative_reference",
      "limitations": [
        "Debe corroborarse con normativa nacional aplicable y fuentes oficiales de Antigua Guatemala."
      ]
    }
  ],
  "citations": [
    {
      "citation_id": "99999999-9999-4999-8999-999999999999",
      "source_id": "55555555-5555-4555-8555-555555555555",
      "document_version_id": "77777777-7777-4777-8777-777777777777",
      "section_id": "88888888-8888-4888-8888-888888888888",
      "label": "Biblioteca oficial de manuales de Mixco",
      "excerpt": "Manual de normas, procesos y procedimientos de la Dirección de Aguas y Drenajes.",
      "source_url": "https://munimixco.gob.gt/manuales/aguas-drenajes",
      "page_start": null,
      "page_end": null,
      "authority_status": "comparative",
      "jurisdiction": "Municipio de Mixco, Guatemala",
      "evidence_status": "comparative_reference"
    }
  ],
  "contradictions": [],
  "missing_evidence": [
    {
      "gap_id": "12121212-1212-4121-8121-121212121212",
      "subject": "Procedimiento de agua para Antigua Guatemala",
      "missing_document": "Manual oficial vigente de agua y saneamiento de Antigua Guatemala",
      "reason": "La referencia comparativa no acredita el procedimiento oficial local.",
      "next_documental_action": "Localizar y validar la fuente oficial de Antigua Guatemala."
    }
  ],
  "limitations": [
    "No incluye estrategia electoral ni recomendaciones de campaña."
  ],
  "provenance": {
    "source_product": "la_muni_rag",
    "generated_by": "ai",
    "created_at": "2026-07-18T18:00:00Z",
    "source_refs": [
      "mixco-mnpp-aguas-drenajes"
    ],
    "credential_id": "33333333-3333-4333-8333-333333333333",
    "audit_id": "44444444-4444-4444-8444-444444444444"
  }
}
